{
 "id": "offer-first",
 "name": {
  "ko": "혜택·구성 프로모션형",
  "en": "Offer-first"
 },
 "status": "measured",
 "version": "0.2",
 "summary": "할인율·회차 가격·혜택 번호 리스트가 첫 화면을 여는 랜딩 문법. 해부 실측: 국내 단품 상세에서는 오퍼가 리드에 오지 않고 신뢰 모듈을 모두 지난 뒤 클로징(계단식 가격표)에 온다. 이 팩은 구독·프로모션·펀딩·강의 랜딩 전용이며, 단품 상세에는 다른 팩 + X10 클로징으로 대체한다.",
 "lead_mode": "discount-numeral-hero",
 "sequence": [
  {
   "tpl": "C2",
   "q": "Q8",
   "role": "할인율·혜택 헤드라인(입력에 있을 때만)"
  },
  {
   "tpl": "K5",
   "q": "Q2",
   "role": "혜택 번호 리스트 01~07"
  },
  {
   "tpl": "X10",
   "q": "Q8",
   "role": "회차별·계단식 가격표"
  },
  {
   "tpl": "P5",
   "q": "Q4",
   "role": "후기 카드(별점·진도율)"
  },
  {
   "tpl": "K11",
   "q": "Q6",
   "role": "받는 것 실물 클로즈업 / 리워드 구성 A·B·C"
  },
  {
   "tpl": "X6",
   "q": "Q5",
   "role": "진행 STEP"
  },
  {
   "tpl": "L2",
   "q": "Q7",
   "role": "FAQ"
  },
  {
   "tpl": "C1",
   "q": "Q7",
   "role": "환불·보증"
  },
  {
   "tpl": "C2",
   "q": "Q8",
   "role": "CTA 반복"
  }
 ],
 "typography": {
  "headline_chars": [
   4,
   14
  ],
  "headline_px": [
   70,
   100
  ],
  "sub_px": 32,
  "body_px": 24,
  "body_lines_max": 3,
  "weight_contrast": "oversized numerals, badge labels, bold CTA line",
  "tone_default": "담백한 존댓말"
 },
 "layout": {
  "align": "center",
  "margin_px": 80,
  "grid_px": 0,
  "cut_gap": "bg-alternate"
 },
 "color_strategy": "mono-brand",
 "emphasis": [
  "big-number",
  "badge",
  "countdown-if-true",
  "cta-repeat"
 ],
 "visual_mode": "dslr-product",
 "evidence_position": {
  "position": "middle",
  "type": "statistical"
 },
 "density_dial": "medium",
 "fits": {
  "categories": [
   "service",
   "subscription",
   "funding",
   "food",
   "living"
  ],
  "awareness": [
   "most-aware",
   "repeat"
  ],
  "traffic": [
   "crm",
   "retarget",
   "platform-event"
  ]
 },
 "image_prompt_style": "bold promotional composition: product bundle laid out, oversized price-anchor numerals only if provided, badge labels, brand color blocks, CTA line bold",
 "sources": [
  "pethroom(subscription landing)",
  "classu(closing ladder)",
  "fastcampus(popup)",
  "wadiz(reward block)"
 ],
 "offer_position": "lead",
 "grammar": [
  "할인율 숫자를 헤드라인급 크기로 1회, 이후 회차별 표로 구체화한다",
  "희소성 숫자(선착순 N명)는 헤드라인 위 배지로, 사실일 때만",
  "시즌 한정 혜택은 본문이 아니라 별도 오버레이 레이어로 분리한다",
  "단독 판매 문구 직후 구성품 실물 클로즈업을 붙여 실재감을 만든다",
  "기만 타이머 금지 — 정가 상승 일정이 실제일 때만 계단표를 쓴다",
  "섹션 전환은 구분선이 아니라 배경색 교차(다크=무드·시연, 화이트/크림=스펙·안내)로 신호한다",
  "정보 블록 2~3개마다 텍스트 없는 사진 컷(X5)을 끼워 리듬을 끊는다",
  "모든 수치·시험 근거 컷 최하단에 회색 소형 각주(기관·기간·인원·측정 기준)를 둔다 — 입력에 있을 때만",
  "사이즈는 표 하나로 끝내지 않고 도해→실측 사진(익숙한 사물·줄자·사람)→캡션의 3중으로 보여준다(X2)",
  "가격·할인·기한은 이미지 안에 두지 않는다. 오퍼가 있으면 신뢰 모듈을 모두 지난 뒤 클로징(X10)에 둔다",
  "법정 표시·스펙 표는 페이지 최말단 텍스트/표로, CTA 버튼은 이미지 밖(플랫폼 UI)"
 ]
}