{
 "id": "proof-first",
 "name": {
  "ko": "근거·수치 우선형",
  "en": "Proof-first"
 },
 "status": "verified",
 "version": "0.3",
 "summary": "첫 화면이 판매량·만족도·검색순위·수상·인증·댓글 캡처 같은 사회적 증거로 열린다. 해부 실측: 권위 근거(시험·인증) → 다수 증언(리뷰 그리드) 순으로 이중 적재하고, 근거 유형을 상·중·하에서 바꿔가며 반복한다. 제품 인지 고객·고가·규제 민감 카테고리. 숫자는 입력에 있는 것만.",
 "lead_mode": "proof-hero",
 "sequence": [
  {
   "tpl": "P1",
   "q": "Q4",
   "role": "근거 히어로 — 판매량·만족도·순위(입력 있을 때) 또는 P2 배지 그리드"
  },
  {
   "tpl": "K2",
   "q": "Q2",
   "role": "제품 각인"
  },
  {
   "tpl": "P2",
   "q": "Q4",
   "role": "인증·수상 배지 그리드"
  },
  {
   "tpl": "K6",
   "q": "Q3",
   "role": "메커니즘 — 사진 + 인증 배지 짝"
  },
  {
   "tpl": "P3",
   "q": "Q3",
   "role": "대조군 계측 카드(A/B)",
   "optional": true
  },
  {
   "tpl": "P4",
   "q": "Q4",
   "role": "Before/After 2분할 + 각주",
   "optional": true
  },
  {
   "tpl": "P5",
   "q": "Q4",
   "role": "리뷰 그리드(권위 → 다수 증언)"
  },
  {
   "tpl": "K4",
   "q": "Q1",
   "role": "사용 장면"
  },
  {
   "tpl": "K11",
   "q": "Q6",
   "role": "구성·원료 실물"
  },
  {
   "tpl": "L1",
   "q": "Q6",
   "role": "스펙 표"
  },
  {
   "tpl": "X3",
   "q": "Q7",
   "role": "선제 FAQ",
   "optional": true
  },
  {
   "tpl": "C1",
   "q": "Q7",
   "role": "보증"
  }
 ],
 "typography": {
  "headline_chars": [
   4,
   14
  ],
  "headline_px": [
   70,
   90
  ],
  "sub_px": 32,
  "body_px": 24,
  "body_lines_max": 3,
  "weight_contrast": "keyword red + conclusion line bold; big statistic numerals",
  "tone_default": "담백한 존댓말"
 },
 "layout": {
  "align": "center",
  "margin_px": 90,
  "grid_px": 0,
  "cut_gap": "bg-alternate"
 },
 "color_strategy": "mono-brand",
 "emphasis": [
  "keyword-red",
  "big-number",
  "certification-badge",
  "framed-chart-panel"
 ],
 "visual_mode": "dslr-product",
 "evidence_position": {
  "position": "top",
  "type": "statistical"
 },
 "density_dial": "medium",
 "fits": {
  "categories": [
   "health_food",
   "beauty",
   "kids",
   "pet",
   "electronics",
   "service"
  ],
  "awareness": [
   "product-aware"
  ],
  "traffic": [
   "repeat",
   "brand-search"
  ]
 },
 "image_prompt_style": "authoritative editorial: product hero with certification marks and a blank framed chart panel (no bars, no numbers), keyword in brand red, conclusion line bold",
 "sources": [
  "harimpet",
  "alzipmat",
  "inflearn",
  "wadiz",
  "anua(body)",
  "romand(body)",
  "spigen"
 ],
 "offer_position": "close",
 "grammar": [
  "근거는 권위(시험·인증·수치) 다음에 다수(리뷰 그리드) 순으로 이중 적재한다",
  "근거 블록마다 시작 표식(예: 반복 배지 바)을 두고 각주에 기관·기간·인원을 적는다",
  "핵심 수치는 문장에 섞지 않고 대형 숫자로 고립시키고 캡션 한 줄만 붙인다",
  "인증은 문서 스캔보다 제품 위 실물 택·공정 근접 촬영으로 보여준다(둘 다 있으면 스캔은 후반)",
  "부정적 가능성(하자·주의)도 Before/After 해결법으로 정면 고지한다",
  "섹션 전환은 구분선이 아니라 배경색 교차(다크=무드·시연, 화이트/크림=스펙·안내)로 신호한다",
  "정보 블록 2~3개마다 텍스트 없는 사진 컷(X5)을 끼워 리듬을 끊는다",
  "모든 수치·시험 근거 컷 최하단에 회색 소형 각주(기관·기간·인원·측정 기준)를 둔다 — 입력에 있을 때만",
  "사이즈는 표 하나로 끝내지 않고 도해→실측 사진(익숙한 사물·줄자·사람)→캡션의 3중으로 보여준다(X2)",
  "가격·할인·기한은 이미지 안에 두지 않는다. 오퍼가 있으면 신뢰 모듈을 모두 지난 뒤 클로징(X10)에 둔다",
  "법정 표시·스펙 표는 페이지 최말단 텍스트/표로, CTA 버튼은 이미지 밖(플랫폼 UI)"
 ]
}