{
 "id": "lookbook",
 "name": {
  "ko": "룩북형",
  "en": "Lookbook"
 },
 "status": "verified",
 "version": "0.3",
 "summary": "첫 화면이 사진(콜라주·착용 장면)만으로 열리고 텍스트는 영문 소형 라벨 + 짧은 한글 한 줄. 해부 실측: 카피가 0에 가까운 페이지도 있으며, 기능 근거는 통계 대신 '행위 장면'(세탁기에 넣기, 저울, 얼음 위)으로 증명한다. 경험재·쾌락재(패션·잡화·리빙·침구·색조).",
 "lead_mode": "photo-collage-or-worn-shot",
 "sequence": [
  {
   "tpl": "F1",
   "q": "Q1",
   "role": "콜라주 또는 착용 히어로 — 영문 라벨 + 제품명만"
  },
  {
   "tpl": "F2",
   "q": "Q4",
   "role": "장면·포즈 변형 2~3"
  },
  {
   "tpl": "F3",
   "q": "Q4",
   "role": "근접(텍스처 매크로)"
  },
  {
   "tpl": "X5",
   "q": "Q1",
   "role": "무카피 사진"
  },
  {
   "tpl": "F6",
   "q": "Q3",
   "role": "DETAIL 포인트 1~3(사진 + 1~2줄)"
  },
  {
   "tpl": "K6",
   "q": "Q3",
   "role": "행위 장면 근거(통계 대신 시연)",
   "optional": true
  },
  {
   "tpl": "X1",
   "q": "Q6",
   "role": "컬러 스와치 매트릭스"
  },
  {
   "tpl": "X2",
   "q": "Q6",
   "role": "사이즈 3중 제시"
  },
  {
   "tpl": "F5",
   "q": "Q6",
   "role": "STYLE/소재 INFO(HTML)"
  },
  {
   "tpl": "X3",
   "q": "Q7",
   "role": "선제 FAQ(소재 특성)",
   "optional": true
  },
  {
   "tpl": "F7",
   "q": "Q7",
   "role": "정책 카드"
  }
 ],
 "typography": {
  "headline_chars": [
   3,
   10
  ],
  "headline_px": [
   40,
   60
  ],
  "sub_px": 26,
  "body_px": 22,
  "body_lines_max": 2,
  "weight_contrast": "uppercase english label (small) over korean head; single bold only",
  "tone_default": "짧은 명사구·구어"
 },
 "layout": {
  "align": "left",
  "margin_px": 80,
  "grid_px": 80,
  "cut_gap": "whitespace-50-160"
 },
 "color_strategy": "white-accent",
 "emphasis": [
  "uppercase-label",
  "single-bold",
  "photo-first"
 ],
 "visual_mode": "lookbook-model",
 "evidence_position": {
  "position": "bottom",
  "type": "narrative"
 },
 "density_dial": "low",
 "fits": {
  "categories": [
   "fashion",
   "accessories",
   "living",
   "beauty_color",
   "fragrance"
  ],
  "awareness": [
   "brand-aware",
   "style-browsing"
  ],
  "traffic": [
   "sns",
   "platform-browse"
  ]
 },
 "image_prompt_style": "editorial lookbook photography, same model/lighting across cuts, neutral background or lived-in interior, text only as a small uppercase label and a short korean line, left aligned on an 80px grid",
 "sources": [
  "hellosleep",
  "konny",
  "rawrow(brand content)",
  "romand(swatch)",
  "existing fashion platform hoodie"
 ],
 "offer_position": "none",
 "grammar": [
  "첫 2,000px 안에 가격·혜택·수치·긴 한글 헤드를 두지 않는다",
  "헤드는 '영문 소형 라벨(라이트) 위 + 한글/숫자 대형 헤드 아래' 2단 구조를 반복한다",
  "텍스트 컷과 풀블리드 사진을 1:1로 교대한다",
  "기능 근거는 통계 문구 대신 행위 클로즈업(세탁·계량·질감)으로 증명한다",
  "모델 다양성(성별·연령)으로 '누구나'를 카피 없이 전달한다",
  "섹션 전환은 구분선이 아니라 배경색 교차(다크=무드·시연, 화이트/크림=스펙·안내)로 신호한다",
  "정보 블록 2~3개마다 텍스트 없는 사진 컷(X5)을 끼워 리듬을 끊는다",
  "모든 수치·시험 근거 컷 최하단에 회색 소형 각주(기관·기간·인원·측정 기준)를 둔다 — 입력에 있을 때만",
  "사이즈는 표 하나로 끝내지 않고 도해→실측 사진(익숙한 사물·줄자·사람)→캡션의 3중으로 보여준다(X2)",
  "가격·할인·기한은 이미지 안에 두지 않는다. 오퍼가 있으면 신뢰 모듈을 모두 지난 뒤 클로징(X10)에 둔다",
  "법정 표시·스펙 표는 페이지 최말단 텍스트/표로, CTA 버튼은 이미지 밖(플랫폼 UI)"
 ]
}